id,title,body,accepted_answer_id,answer_count,comment_count,community_owned_date,creation_date,favorite_count,last_activity_date,last_edit_date,last_editor_display_name,last_editor_user_id,owner_display_name,owner_user_id,parent_id,post_type_id,score,tags,view_count
8202061,html/asp.net formatting  display data using text boxes datagrid and a combination of things,<p>This might be a weird question but I know what I'm looking for i just don't know what it's called.</p> <p>I've created a few textboxes with no borders and some labels that go next to them. And in each of these text boxes contains some part of data from a Datatable in these textboxes is a distinct piece of data from the returned rows.</p> <p>Below all of that is a DataColumn that displays the details of all the rows for that particular item. </p> <p>For the life of me I cannot get this setup to look visually appealing. The textboxes aren't on the same column the datarow is to far apart. Is there a control I'm looking for that would help me out? Instead of creating each element individually?</p>,8204149,1,1,,11/20/2011 14:11:51,,11/20/2011 19:41:59,11/20/2011 16:28:53,,639604,user222427,,,1,0,c#|asp.net|datagrid,164
14778924,How to migrate joomla 1.5.18 to 1.5.20 - hacked,<p>Hi some one hacked my joomla site</p> <p>I am not able to access to administrator/index.php?option=com_config  it is giving 404 error. The hacker is hacked by s13doeL  he added joomla.class.php and index.old.php in all over the web files. </p> <p>I think there is only one solution reistall everything. Could someone help to migrate from 1.5.18 to 1.5.20. I do not want to change to 2.5 because that template is not supported to 2.5.</p> <p>Is it just enough copy all database and then link to it? Does it copy all old articles? or do I have to copy ann manualy?</p>,14780603,1,1,,2/8/2013 18:21:49,,8/30/2014 20:21:08,8/30/2014 20:21:08,,3366929,anon,,,1,-6,joomla|backup|joomla1.5,1401
23318390,SELECT specific records when DISTINCT wont make it,<p>I have two tables:</p> <pre><code>tbl_Artist AristID Name Info </code></pre> <p>And</p> <pre><code>tbl_Ad AdID ArtistID Venue DateFrom DateTo </code></pre> <p>An artist may have several ads for different shows. I run the following statement to select what artists are in town on a date-range based on the dates in the ads. </p> <pre><code>SELECT DISTINCT tbl_Artist.Name tbl_Ad.DateFrom tbl_Ad.DateTo FROM tbl_Artist INNER JOIN tbl_Ad ON tbl_Ad.AdID = tbl_Ad.ArtistID WHERE DateFrom BETWEEN #12/1/2014# AND #12/10/2014# OR DateTo BETWEEN #12/1/2014# AND #12/10/2014# OR DateFrom &lt; #12/1/2014# AND DatoTo &gt; #12/10/2014#; </code></pre> <p>Which gives me the following result:</p> <pre><code>Artist1 02.12.14 - 10.12.14 Artist2 03.12.13 - 08.12.14 Artist2 03.12.13 - 07.12.14 </code></pre> <p>The date on one of the shows ends one day before the other which makes him come up twice. I want to make a selection that shows 2 artist on 07.12.14 and 08.12.14 but only one on 10.12.14.</p> <p>How do I solve this?</p>,23320345,1,2,,4/27/2014 1:34:26,,4/27/2014 6:53:33,4/27/2014 1:42:57,,541091,user2308227,,,1,0,sql|ms-access|ms-access-2013,47
7485222,file parsing with a condition display on screen,<p>My code is currently building with no errors. It is searching in an xml file for values and I need for it to check if the values are within a range that determines if they pass/fail. I believe I have the code right but I need the pass/fail to display on the screen. Any help?</p> <pre><code>var query = from file in fileEntries let doc = XDocument.Load(file) let x = doc.Descendants( XAxisCalib ).Single() let y = doc.Descendants( YAxisCalib ).Single() let z = doc.Descendants( ZAxisCalib ).Single() select new { XMax = x.Element( Max ).Value XMin = x.Element( Min ).Value YMax = y.Element( Max ).Value YMin = y.Element( Min ).Value ZMax = z.Element( Max ).Value ZMin = z.Element( Min ).Value }; var results = from item in query select new { XMaxResult = Convert.ToInt32(item.XMax) &lt; 290 ? pass : fail  XMinResult = Convert.ToInt32(item.XMin) &gt; -50 ? pass : fail  YMaxResult = Convert.ToInt32(item.YMax) &lt; 645 ? pass : fail  YMinResult = Convert.ToInt32(item.YMin) &gt; -87 ? pass : fail  ZMaxResult = Convert.ToInt32(item.ZMax) &lt; 20 ? pass : fail  ZMinResult = Convert.ToInt32(item.ZMin) &gt; -130 ? pass : fail  }; </code></pre> <p>Sample Xml: (more lines but deleted for simplicity) </p> <pre><code> &lt;XAxisCalib&gt; &lt;Max&gt;296&lt;/Max&gt; &lt;Min&gt;-51.04&lt;/Min&gt; &lt;/XAxisCalib&gt; &lt;YAxisCalib&gt; &lt;Max&gt;640&lt;/Max&gt; &lt;Min&gt;-24.6&lt;/Min&gt; &lt;/YAxisCalib&gt; &lt;ZAxisCalib&gt; &lt;Max&gt;29.67&lt;/Max&gt; &lt;Min&gt;-129&lt;/Min&gt; </code></pre>,7485399,1,2,,9/20/2011 12:33:33,,9/20/2011 15:20:36,9/20/2011 15:20:36,,834063,user933467,,,1,2,c#|xml|linq-to-xml|xml-parsing,105
19959461,Executing SSIS package programmatically,<p>Below is the code I will be referring to. A few questions: </p> <ol> <li><p>Am I able to reference two different .DTSX files within one String pkgLocation = statement? (I did it below) if I am unable to do so and have over 10 different packages to execute programmatically is there a quick and painless way to go about this?</p></li> <li><p>Does the code below represent Entity Framework at all?</p></li> <li><p>Its been a while since I played with SSIS and I am wondering how to specifically execute it? simply pressing Run shows me nothing within the Test Explorer (probably because its not a test) and when I attempt to Execute it I receive a message stating project with an output type of class library cannot be started directly What does that even mean?</p></li> <li><p>Am I on the right track? (with regards to executing these packages programmatically)</p></li> </ol> <hr> <pre><code>public class UnitTest1 { private void Execute_Package() { string pkgLocation = @ C:\tfs\z Reports\BI Projects\Customer Service Data Warehouse\Customer Service Data Warehouse + @ C:\tfs\z Reports\BI Projects\Customer Service Data Warehouse\SRS DataMart SSIS\SRSDimCategorizationLoad.dtsx ; Package pkg; Application app; DTSExecResult pkgResults; Variables vars; app = new Application(); pkg = app.LoadPackage(pkgLocation null); vars = pkg.Variables; vars[ A_Variable ].Value = Some value ; pkgResults = pkg.Execute(); } } </code></pre> <hr> <p>Here is the <strong>old code</strong> that I made into the code above:</p> <pre><code>private static void LoadTicketLifeCycleSnapShotFact() { ExceutePackage(@ C:\tfs\z Reports\BI Projects\Customer Service Data Warehouse\Customer Service Data Warehouse\SAPBPDataToStage.dtsx ); ExceutePackage(@ C:\tfs\z Reports\BI Projects\Customer Service Data Warehouse\SRS DataMart SSIS\SRSDimCategorizationLoad.dtsx ); </code></pre>,19960355,1,3,,11/13/2013 16:41:48,,8/11/2015 15:53:04,8/11/2015 15:53:04,,1015495,user2980712,,,1,1,c#|visual-studio-2012|ssis|package,802
30541670,Redirecting R help message to a text file,<p>I have R installed on Linux. To get instant help I type on the prompt as:</p> <pre><code>?read.table </code></pre> <p>Is it possible to redirect this help message to a text file. For example if I want Linux man page to be redirected to a text file I write on the shell as:</p> <pre><code>$ man cp | col -b &gt; cp_help.txt </code></pre> <p>Such text file is of great help as I can search within it or scroll fast up and down or add my comments/examples for future or distribute to students.</p>,30544252,1,3,,5/30/2015 0:55:55,,5/30/2015 9:02:51,5/30/2015 4:20:17,,980833,user3282777,3282777,,1,2,r,48
25319230,Apply CSS features only to one div using classes?,<p>I found this tutorial on css:</p> <p><a href= http://designshack.net/articles/css/5-simple-and-practical-css-list-styles-you-can-copy-and-paste/ rel= nofollow >http://designshack.net/articles/css/5-simple-and-practical-css-list-styles-you-can-copy-and-paste/</a></p> <p>it says css file:</p> <pre><code>* {margin: 0; padding: 0;} div { margin: 20px; } ul { list-style-type: none; width: 500px; } h3 { font: bold 20px/1.5 Helvetica Verdana sans-serif; } li img { float: left; margin: 0 15px 0 0; } li p { font: 200 12px/1.5 Georgia Times New Roman serif; } li { padding: 10px; overflow: auto; } li:hover { background: #eee; cursor: pointer; } </code></pre> <p>and the html file:</p> <pre><code>&lt;html&gt; &lt;head&gt; &lt;title&gt;title&lt;/title&gt; &lt;link href= s.css rel= stylesheet &gt; &lt;/head&gt; &lt;body&gt; &lt;div&gt; &lt;ul&gt; &lt;li&gt; &lt;img src= http://lorempixum.com/100/100/nature/1 &gt; &lt;h3&gt;Headline&lt;/h3&gt; &lt;p&gt;Lorem ipsum dolor sit amet...&lt;/p&gt; &lt;/li&gt; &lt;li&gt; &lt;img src= http://lorempixum.com/100/100/nature/2 &gt; &lt;h3&gt;Headline&lt;/h3&gt; &lt;p&gt;Lorem ipsum dolor sit amet...&lt;/p&gt; &lt;/li&gt; &lt;li&gt; &lt;img src= http://lorempixum.com/100/100/nature/3 &gt; &lt;h3&gt;Headline&lt;/h3&gt; &lt;p&gt;Lorem ipsum dolor sit amet...&lt;/p&gt; &lt;/li&gt; &lt;li&gt; &lt;img src= http://lorempixum.com/100/100/nature/4 &gt; &lt;h3&gt;Headline&lt;/h3&gt; &lt;p&gt;Lorem ipsum dolor sit amet...&lt;/p&gt; &lt;/li&gt; &lt;/ul&gt; &lt;/div&gt; &lt;/body&gt; &lt;/html&gt; </code></pre> <p>it worked great but I want to put the css features only to one div not the whole site so I tried to put all css features in class like this:</p> <pre><code>div.list{ * {margin: 0; padding: 0;} div { margin: 20px; } . . . . . . . . . } </code></pre> <p>and change the html to:</p> <pre><code>&lt;div class= list &gt; </code></pre> <p>I also tried to put them in <code>.list</code> class but I have lost all the formatting what should I do?</p>,25319262,1,3,,8/14/2014 23:38:27,,8/14/2014 23:58:38,8/14/2014 23:58:38,,3558960,user3904830,,,1,2,html|css|class,215
31627145,C# ParseExact TimeSpan not recognized,<p>I have a simple string of arrayData that i'm trying to run a TimeSpan.ParseExact and i'm getting invalid format errors. For the life of me I can't figure out what i'm going wrong and it's driving me nuts</p> <pre><code>string arrayData = 00:02:02.4000000 ; string[] formats = new string[] { @ s\.f  @ ss\.f  @ ss\.ff  @ m\:ss\.f  @ m\:ss\.ff  @ mm\:ss\.ff  @ hh\:mm\:ss\.ff  @ dd\.hh\:mm\:ss }; CultureInfo culture = new CultureInfo( en-US ); TimeSpan _timeSpan = TimeSpan.ParseExact(arrayData formats culture.NumberFormat); </code></pre>,31627190,1,4,,7/25/2015 13:48:48,,7/25/2015 14:50:49,7/25/2015 14:50:49,,5146226,user222427,,,1,1,c#|timespan,58
17240880,OpenGL and DirectX,<p>Can somebody explain to me the dumb version of what OpenGL and directX is? Were they both created by pure computer language like java c++ C# Objective C or are they a language all to themselves. In other words LGjWL uses openGL right? So was it created straight from the pure Java API like when you create your own package in java?</p>,17246091,1,6,,6/21/2013 17:17:43,,6/22/2013 0:21:29,6/21/2013 18:10:58,,44729,user1959349,,,1,0,java|opengl|directx,437
22883935,MySQL Search/Replace with a variable number,<p>I have some string which I need to replace in my database using a SQL query. The string is:</p> <blockquote> <p>[attachment=<strong>NUMBER</strong>]image.jpg[/attacment]</p> </blockquote> <p>I want to wrap that image.jpg with an HTML image tag but the <strong>NUMBER</strong> is screwing me up because it will be different for each string. Is there a wildcard character I can use in this query which will find any number?</p> <p>Here's my search/replace query:</p> <pre><code>UPDATE `hd_posts` SET `post_content` = replace(post_content '[attachment=NUMBER]' '&lt;img src= http://mydomain.com/my-theme/images/') </code></pre> <p>and then...</p> <pre><code>UPDATE `hd_posts` SET `post_content` = replace(post_content '[/attachment]' ' /&gt;') </code></pre> <p>...so that I will end up with this:</p> <pre><code>&lt;img src= http://mydomain.com/my-theme/images/image.jpg /&gt; </code></pre> <p>Can anyone help? What do I use for <strong>NUMBER</strong>? I have a feeling that this is not too difficult but I am a complete novice at this. Of course I've searched and searched but I can't find this exact situation anywhere from which to learn. These two almost gave me what I need:</p> <p><a href= http://stackoverflow.com/questions/15806609/mysql-replace-variable-string >MySQL REPLACE variable string</a> <a href= http://stackoverflow.com/questions/22426115/search-replace-in-mysql-using-regex >Search &amp; replace in MySql using regex</a></p> <p>but not quite. I'm still confused! Thanks for any help.</p> <p>If I use that first link as an example...</p> <pre><code>UPDATE `hd_posts` SET `post_content` = CONCAT(SUBSTRING(post_content 1 INSTR(post_content'[attachment') - 1) SUBSTRING(post_content INSTR(post_content ']') LENGTH(post_content) - INSTR(post_content '[attachment')) ) </code></pre> <p>I have no idea...in that example he was trying to replace a string with '' (remove it) but I don't see how he is doing that and I don't see how I can learn from it enough to do what I need to do.</p>,22887484,1,8,,4/5/2014 17:00:19,,4/5/2014 22:08:37,4/5/2014 17:56:38,,767881,user2156859,,,1,0,mysql|sql|regex,131
420638,Mapping a USB drive to a USB hub & port in Windows,<p>What's the best way of mapping out where all the USB drives are plugged in? Ideally I'd like to be able to recursively start from the root hub and keep going down the tree finding connect usb drives and what port they are connected to (which physical USB slot).</p>,421301,1,0,,1/7/2009 15:05:51,,1/7/2009 17:56:16,,,,Abdullah Jibaly,47110,,1,0,windows|usb,1539
28811441,Subversion Export option in Android Studio,<p>I have started working on Android Studio and set up a project on subversion. We are working in a team and for some of the tasks and backup purpose sometimes we need to give the code of the project after omitting the .svn files. I need to skip this files because I don't want other users to track the code or take further updates of code and also it sometimes takes unnecesary space when I take backup of it in my local machine.</p> <p>Now in Eclipse I can easily export or disconnect the project from svn and it will omit the .svn files but there is no such option in Android Studio. Can anyone please help me to do so.</p> <p>Thanks in Advance for trying to help.</p>,28812759,1,0,,3/2/2015 13:51:02,,3/2/2015 14:55:02,,,,user821127,,,1,0,android|eclipse|svn|android-studio,525
326648,Retrieving a byte array stored in a INT field in the database,<p>how do I retrieve the byte array stored in an integer column in my database?</p> <p>Do I first case it as int then as byte[] ?</p> <p>byte[] permissions = (byte) Convert.ToInt(dr[ myField ]);</p> <p>?</p>,326667,1,0,,11/28/2008 20:50:35,,11/28/2008 21:07:59,,,,Blankman,39677,,1,0,.net|ado.net|bytearray,530
24725855,Xcode 5: has static analyzer clang by default?,<p>I have Xcode 5. If I click the Product->Analyze item in the menu does it mean clang static analyzer is invoked?</p>,24725919,1,0,,7/13/2014 18:24:56,,7/13/2014 18:34:33,7/13/2014 18:34:33,user2793162,,user2793162,,,1,0,xcode|clang,25
273726,Getting the GMarkers that have been added to a Google map?,<p>Is there a way to get a list of all the GMarkers that have been added to a map? </p>,273856,1,0,,11/7/2008 21:39:53,,11/7/2008 22:37:00,,,,Readonly,4883,,1,0,google-maps,580
28520911,Mixed layout types?,<p>I'm creating a simple app. What's the best way do create GUI like this? How do I mix layouts?</p> <p><a href= http://s15.postimg.org/iic9v0v97/example.png rel= nofollow >http://s15.postimg.org/iic9v0v97/example.png</a></p>,28521025,1,0,,2/14/2015 22:16:31,,2/15/2015 11:56:34,,,,user4556228,,,1,0,android|android-layout,105
6509996,JScript conditional compilation + JavaScript compression = preprocessor?,<p>Do any of the JS compressors allow you to do <code>#ifdef</code>-pre-processing-type things with <a href= http://www.javascriptkit.com/javatutors/conditionalcompile2.shtml rel= nofollow >JScript conditional compilation</a>?</p> <p>If <code>@set</code> to defines a “variable” couldn't a JS compressor remove code that the conditional compilation logic defines at not compiled?</p> <p>I'm a little unsure of JScript syntax but perhaps something like this</p> <pre><code>/*@cc_on @set (@version = 1) @if (@version == 1) alert('Version 1'); @else alert('Not version 1'); @end @*/ </code></pre> <p>could compress into</p> <pre><code>alert('Version 1'); </code></pre>,6510330,1,0,,6/28/2011 16:41:22,,6/28/2011 17:03:21,,,,user213154,,,1,0,javascript|compression|conditional-compilation,410
7107313,Android: Accessing a function within a thread and getting the result?,<p>In my android service I'm starting a new thread like this</p> <pre><code> thread = new Thread(new Runnable() { public void run() { new myClassName(getApplicationContext()); } }); thread.start(); </code></pre> <p>The class is ran in a separate thread because it would otherwise block the service thread (causes timeout). That code is in the onCreate method and is alive the whole time whilst the service is alive (unless it crashes of course).</p> <p>Now I need to have a function in myClassName which returns a String. I've not actually created that function yet but I'm trying to test it with a function which simply returns hello  so let's call that function helloFn .</p> <pre><code> public String helloFn(String name) { return hello +name; } </code></pre> <p>How can I call helloFn which is inside the thread I just created from my service? Thanks!</p>,7107361,1,0,,8/18/2011 12:21:24,,8/18/2011 12:26:54,,,,user873578,,,1,0,android|multithreading|service,179
23349527,How to scale image view with different scene size in javafx?,<p>i have an scene with 1024 width in 600 height and i have an image with this size 1800x1022 i add this image to ImageView and call setFitWith &amp; Height to scale it with my scene . but i want if some One click on maximize button the imageVew scale to new size.Any Idea?</p>,23349589,1,0,,4/28/2014 19:24:19,,4/28/2014 19:37:56,,,,user2768684,,,1,0,java|javafx,222
23401007,How to make Chunk underline or bold to display in a pdf,<p>I've been wracking my brain for a couple of days and I am unable to get this working. I am trying to use itextsharp in vb.net and MVC to format a field with bold or underline and then see those changes in the resulting PDF. I am not getting errors but nothing I do changes the fields. The PDF loads fine but the formatting of the fields never changes.</p> <p>I am trying to convert the text into a pdf paragraph then loop through its chunks and apply formatting. Then I would like to use SetField to fill the field with the resulting string. Something like:</p> <pre><code>stamper.AcroFields.SetField(fieldName formattedString) </code></pre> <p>I am new to this so I am not sure where to troubleshoot further. I have also tried creating a new font and adding that and the document remains unchanged. </p> <p>I can't upload the PDF file for inspection but if there is something I should check in the PDF file that might cause this please let me know. The file is in XFA format.</p> <p>I have the pseudo-code below:</p> <ol> <li><p>The code that calls the GenerateDocument function:</p> <pre><code>Dim pdf As Byte() pdf = GenerateDocument() Return File(pdf application/pdf ) </code></pre></li> <li><p>The GenerateDocument function(simplified):</p> <pre><code>Public Function GenerateDocument() As Byte() Using inStream As New MemoryStream(TemplateBinary) 'the actual pdf binary Using outStream As New MemoryStream Dim pdfReader As New text.pdf.PdfReader(inStream) Dim stamper As New PdfStamper(pdfReader outStream) Dim form As AcroFields = stamper.AcroFields Dim fieldKeys = form.Fields.Keys stamper.AddViewerPreference(PdfName.HIDETOOLBAR New PdfBoolean(True)) stamper.AddViewerPreference(PdfName.FITWINDOW New PdfBoolean(True)) stamper.FormFlattening = False Dim pdfSegment As Paragraph = CreateSimpleHtmlParagraph( sample text ) Dim pdfString As New StringBuilder If pdfSegment.Count &gt; 0 Then For counter As Integer = 0 To pdfSegment.Count - 1 Dim para As Paragraph If pdfSegment(counter).GetType().Name().ToUpper().Contains( PARAGRAPH ) Then para = pdfSegment(counter) For Each ch As Chunk In para ch.SetUnderline(0.5F -1.5F) 'just make everything underline for now Next pdfString.Append(para.Content) End If If counter &lt; (pdfSegment.Count - 1) Then pdfString.AppendLine() End If Next form.SetField(xNode.Name pdfString.ToString()) End If stamper.Close() pdfReader.Close() Return outStream.ToArray() End Using End Using End Function </code></pre></li> <li><p>The code that makes a PDF paragraph called from the code above</p> <pre><code>Private Function CreateSimpleHtmlParagraph(text As String) As Paragraph Dim pdfTextSection As New Paragraph() Using sr As StringReader = New StringReader(text) Dim elements As List(Of IElement) = iTextSharp.text.html.simpleparser.HTMLWorker.ParseToList(sr Nothing) For Each e As IElement In elements pdfTextSection.Add(e) Next End Using Return pdfTextSection </code></pre> <p>End Function</p></li> </ol>,23403275,1,0,,5/1/2014 2:00:36,,5/1/2014 6:42:21,,,,user1867374,,,1,0,itextsharp,739
691080,Set Identity Seed to 0 Using NHibernate SchemaExport,<p>I'm using the SchemaExport class in NHibernate to generate my database from my .hbm.xml files. Is there a way to set the Identity Seed on my tables to 0 rather than 1? For ref tables I prefer to have all my initial status ids set to 0 and I don't want to have to reset this value every time I regenerate my DB while in dev. I'm using SQL Server 2005 NHibernate version 1.2.1.</p>,697925,1,0,,3/27/2009 19:03:43,,3/17/2015 5:13:39,,,,Mark Struzinski,1284,,1,0,nhibernate|nhibernate-mapping,1001
26821511,Why is the arr array not in the users object after creation of it?,<p>I am try to make arr a array that every user has but is never sent to client side. A day ago the it stopped being put into user objects on user create. Here is the code; thanks.</p> <p>client </p> <pre><code>Template.create_user.events({ 'click #create-user-button': function() { var username = $( #username ).val(); var password = $( #password ).val(); var email = $( #email ).val(); var bio = $( #bio ).val() || ; if (!username || !password || !email) { } else { Accounts.createUser({ username: username password: password email: email arr:[] profile: { bio: bio } }); } } }); </code></pre> <p>server/user.js</p> <pre><code>Accounts.onCreateUser(function(options user) { if (options.profile) user.profile = options.profile; return user; }); </code></pre>,26822028,1,0,,11/8/2014 20:03:26,,11/8/2014 20:59:23,,,,user3924026,,,1,1,mongodb|meteor|user,31
27964035,jquery event logged. how does it work exactly?,<p>I was searching in jquery api.documentation and found this code example:</p> <pre><code>var event = jQuery.Event( logged ); event.user = foo ; event.pass = bar ; $( body ).trigger( event ); </code></pre> <p>I was trying to understand how this can interact with html code... but it looks impossible to me... and I'm still stunned</p> <p>Can anyone explain something about? Thanks in advance.</p>,27964092,1,0,,1/15/2015 12:59:03,,1/15/2015 13:51:59,,,,user4227915,,,1,1,javascript|jquery|html,46
34118737,how can I deploy wp_pagenavi in News Custom Post Type plugin,<p>I installed News Custom Post Type plugin for news in wordpress. Its working fine but want to integrate with another plugin for pagination wp_pagenavi.</p> <p>I am very new to wordpress and php. can anybody know here as to how can I switch wp_pagenavi with news plugin?</p>,34118821,1,0,,12/6/2015 14:53:45,,12/6/2015 15:01:42,,,,user5575822,,,1,1,php|wordpress|wordpress-plugin,50
19988659,A skeleton for dealing with named arguments:,<p>Could someone give me a basic skeleton too that allows me to run diffrent command line parameters.</p> <p>For Example</p> <pre><code>cscript TestSpeed.vbs /Internet 'or cscript testSpeed.vbs /RW </code></pre>,19988711,1,0,,11/14/2013 21:21:53,,11/14/2013 21:24:29,,,,user2985103,,,1,1,vbscript|cmd,63
34781987,Highlight count with date on jQuery UI calendar,<p>I'm trying to implement jquery ui calendar for my event section which is working fine no doubt but I've one custom requirements in that calendar I wanted to highlight no of events also on particular that for example there's 2 events on 21st jan and 3 on 25th jan then it will show bit highlight to those dates with count.</p> <p>Is it possible with jquery ui</p> <pre><code>$(document).ready(function(){ $('#event').datepicker(); }); </code></pre>,34784840,1,0,,1/14/2016 4:54:16,,1/14/2016 8:32:54,,,,user4861457,,,1,1,javascript|jquery|jquery-ui|calendar,77
6555683,SEO friendly url for Zend framework site with htaccess,<p>Can any one tell me how to make SEO friendly url for Zend framework site with htaccess ?</p> <p>Example : </p> <pre><code>http://www.example.com/search/detail/guid/40812 </code></pre> <p>will look like</p> <pre><code> http://www.example.com/search/user's category/user's name like: http://www.example.com/search/doctors/Rahul Sharma </code></pre>,6556049,1,0,,7/2/2011 7:25:11,,7/2/2011 8:59:05,,,,user319198,,,1,1,php|zend-framework|seo|friendly-url,1705
23876202,Programmatically hide an app from the LRU list,<p>I want to hide my app from the least recently used list (LRU) - the one that shows when you long press the home button. Can it be done? Thx.</p> <p><strong>Edit</strong>: this app does it: <a href= https://www.youtube.com/watch?v=LBNwCZX8Cbo#t=99 rel= nofollow >https://www.youtube.com/watch?v=LBNwCZX8Cbo#t=99</a></p> <p>so it seems that it can be done.</p>,23876254,1,0,,5/26/2014 18:56:23,,5/26/2014 19:00:29,5/26/2014 19:00:12,user2265501,,user2265501,,,1,1,android|lru,198
