id,title,body,accepted_answer_id,answer_count,comment_count,community_owned_date,creation_date,favorite_count,last_activity_date,last_edit_date,last_editor_display_name,last_editor_user_id,owner_display_name,owner_user_id,parent_id,post_type_id,score,tags,view_count
33519225,Cannot deploy website using Precompile during publishing option,<p>I am trying to publish my web app.</p> <p>Here is a picture of my setting for my publishing profile: <a href= http://i.stack.imgur.com/L3Mjg.png rel= nofollow ><img src= http://i.stack.imgur.com/L3Mjg.png alt= enter image description here ></a></p> <p>As you can see I have the Precompile during publishing option checked.</p> <p>Here is the Configuration settings for Precompile during publish . <a href= http://i.stack.imgur.com/ku15L.png rel= nofollow ><img src= http://i.stack.imgur.com/ku15L.png alt= enter image description here ></a></p> <p>When this is checked and I try and publish my web app I get an error on one of my pages. When I hover over the tab to see the file location the location is at: <strong><em>C:\Users\akemp.WT\AppData\Local\Temp\WebSitePublish...</em></strong> This is not the location of my source code and if I make the changes on my local page the site in the above given path does not get updated.</p> <p>When I unchecked the Precompile during publishing option my website published without any hassle.</p> <p>What is going on here?</p>,33521752,2,2,,11/4/2015 10:19:05,,11/4/2015 12:25:20,11/4/2015 12:25:20,,952480,user1269016,,,1,1,c#|.net|visual-studio-2015,476
15987592,manual or automatic type casting in c++,<p>I'm wondering if I use static_cast rather than let the compiler find out if an object can be casted and do it by itself may it cost less compilation time or not? Approx. 3000 lines of c++ code I'm taling about. For example: </p> <pre><code>stack&lt; const something*&gt; myStack; // ... myStack.push(/* not const */ something*) </code></pre> <p>vs. </p> <pre><code>stack&lt; const something*&gt; myStack; // ... myStack.push(static_cast&lt; const something*&gt;(something*)). </code></pre> <p>I've learned ada language in the university and i'm a little confused since then about whether I should do the casting or let the compiler do it.</p>,15987745,2,2,,4/13/2013 12:04:47,,4/13/2013 12:32:07,4/13/2013 12:22:58,,1932150,user2277354,,,1,2,c++|casting,300
26762218,$().html() will work only on first time,<p>I have a page which has a div which says Hide code I have also a p with stuff inside That div is supposed to check if that p is visible. If yes it will hide the p and change the content of the div to Show code That works only on first time I mean if the p is hidden it will be shown and forth back but the content of the div will only change to Show code and never back to Hide code My code:</p> <pre><code>&lt;div id= toggleCode &gt;Hide code&lt;/div&gt; &lt;p id= code &gt; At first this is visible &lt;/p&gt; #toggleCode{ color:red; background:dodgerblue; } $(document).ready(function(){ $( #codearea ).css({ height : 15em  width : 15em  background : gold  margin-top : 5em  border : 4px solid aqua }); $( .ranges ).change(function(){ $tl=$( #tl ).val()+ px $tr=$( #tr ).val()+ px $bl=$( #bl ).val()+ px $br=$( #br ).val()+ px $code=$tl+$tr+$br+$bl; $( #codearea ).css( border-radius $code); }); $( #toggleCode ).click( function(){ if ($( #code ).is( :visible )){ $( #toggleCode ).html( Show code ); $( #code ).hide(); } else{ $( #toggle ).html( Hide code ); $( #code ).show(); } }); $( #resetCode ).click( function () { $( .ranges ).val(0); $( #codearea ).css( border-radius 0); }); }); </code></pre> <p>And a jsfiddle:<a href= http://jsfiddle.net/9yrjuhv4/ rel= nofollow >http://jsfiddle.net/9yrjuhv4/</a> Any ideas</p>,26762267,2,2,,11/5/2014 16:30:04,,11/5/2014 20:56:42,11/5/2014 20:56:42,user4103823,,user4103823,,,1,2,javascript|jquery|html|css,82
14354933,Error in opening streaming video,<p>I'm trying to open video stream by giving the url of the video. I'm using <code>VideoView</code>.Here is my code:</p> <pre><code>public class MainActivity extends Activity { @Override public void onCreate(Bundle savedInstanceState) { super.onCreate(savedInstanceState); setContentView(R.layout.activity_main); VideoView videoView = (VideoView) findViewById(R.id.stream_video_view); videoView.setVisibility(View.VISIBLE); MediaController mc = new MediaController(this); mc.setAnchorView(videoView); mc.setMediaPlayer(videoView); videoView.setMediaController(mc); Uri uri = Uri.parse( http://172.16.154.106:8080 ); videoView.setVideoURI(uri); videoView.requestFocus(); videoView.start(); } } </code></pre> <p><strong>LogCat:</strong></p> <pre><code>01-16 15:58:16.042: D/MediaPlayer(2054): Couldn't open file on client side trying server side 01-16 15:58:16.078: E/MediaPlayer(2054): Unable to to create media player 01-16 15:58:16.082: W/VideoView(2054): Unable to open content: http://172.16.154.106:8080 01-16 15:58:16.082: W/VideoView(2054): java.io.IOException: setDataSource failed.: status=0x80000000 01-16 15:58:16.082: W/VideoView(2054): at android.media.MediaPlayer._setDataSource(Native Method) 01-16 15:58:16.082: W/VideoView(2054): at android.media.MediaPlayer.setDataSource(MediaPlayer.java:844) 01-16 15:58:16.082: W/VideoView(2054): at android.media.MediaPlayer.setDataSource(MediaPlayer.java:806) 01-16 15:58:16.082: W/VideoView(2054): at android.widget.VideoView.openVideo(VideoView.java:221) 01-16 15:58:16.082: W/VideoView(2054): at android.widget.VideoView.access$2000(VideoView.java:49) 01-16 15:58:16.082: W/VideoView(2054): at android.widget.VideoView$6.surfaceCreated(VideoView.java:465) 01-16 15:58:16.082: W/VideoView(2054): at android.view.SurfaceView.updateWindow(SurfaceView.java:562) 01-16 15:58:16.082: W/VideoView(2054): at android.view.SurfaceView.access$000(SurfaceView.java:82) 01-16 15:58:16.082: W/VideoView(2054): at android.view.SurfaceView$3.onPreDraw(SurfaceView.java:171) 01-16 15:58:16.082: W/VideoView(2054): at android.view.ViewTreeObserver.dispatchOnPreDraw(ViewTreeObserver.java:590) 01-16 15:58:16.082: W/VideoView(2054): at android.view.ViewRootImpl.performTraversals(ViewRootImpl.java:1596) 01-16 15:58:16.082: W/VideoView(2054): at android.view.ViewRootImpl.handleMessage(ViewRootImpl.java:2418) 01-16 15:58:16.082: W/VideoView(2054): at android.os.Handler.dispatchMessage(Handler.java:99) 01-16 15:58:16.082: W/VideoView(2054): at android.os.Looper.loop(Looper.java:137) 01-16 15:58:16.082: W/VideoView(2054): at android.app.ActivityThread.main(ActivityThread.java:4340) 01-16 15:58:16.082: W/VideoView(2054): at java.lang.reflect.Method.invokeNative(Native Method) 01-16 15:58:16.082: W/VideoView(2054): at java.lang.reflect.Method.invoke(Method.java:511) 01-16 15:58:16.082: W/VideoView(2054): at com.android.internal.os.ZygoteInit$MethodAndArgsCaller.run(ZygoteInit.java:784) 01-16 15:58:16.082: W/VideoView(2054): at com.android.internal.os.ZygoteInit.main(ZygoteInit.java:551) 01-16 15:58:16.082: W/VideoView(2054): at dalvik.system.NativeStart.main(Native Method) 01-16 15:58:16.082: D/VideoView(2054): Error: 10 01-16 15:58:16.232: D/gralloc_goldfish(2054): Emulator without GPU emulation detected. </code></pre> <p>On executing this I'm not getting any error but I'm getting a dialog box with title cannot play video and with message Sorry this video can't be played . Any ideas why my code is not working? </p>,14354988,2,2,,1/16/2013 9:24:02,,1/16/2013 11:54:19,1/16/2013 10:29:42,user1310152,1341006,user1310152,1341006,,1,4,android|video-streaming|android-mediaplayer,5584
1389981,Can a language be Turing-complete without any support for arrays?,<p>If a language has control structures and variables but no support for arrays lists memory access and allocation etc can it be Turing-complete?</p> <p>Maybe if there was no limit to the amount of variables you can create you can simulate arrays by creating variables like <code>array_1</code> <code>array_2</code> ... <code>array_6000</code> and manually loop through them and somehow create complex data structures and recursion?</p> <p><em>Edit</em>: Even if you cannot access variables by name manipulation (<code>array_10+i</code> is not allowed)?</p>,1389993,2,2,,9/7/2009 15:56:09,,9/7/2009 16:26:00,9/7/2009 16:08:00,unknown,,unknown,,,1,5,turing-complete,739
4030275,How to insert partial data into a Mysql table?,<pre><code>INSERT INTO sitelist(idrankwebsiteaddresstag1tag2tag3tag4tag5tag6tag7tag8tag9tag10) VALUES ('''''''search''searchengine''discover''find''tag5''tag6''tag7''tag8''tag9''tag10') WHERE `id`=1 </code></pre> <p>The thing is that the first row is like this</p> <p>1 1 google.com nothing nothing etc</p> <p>I want to insert search searchengine discover find tag5 tag6 etc instead of nothing. </p>,4030282,2,4,,10/27/2010 5:39:32,,10/27/2010 5:51:41,10/27/2010 5:51:41,user244333,,user244333,,,1,0,php|mysql,1849
15692993,C++ - QtCreator doesn't show any output,<pre><code>#include &lt;QCoreApplication&gt; #include &lt;QDebug&gt; int main(int argc char *argv[]) { QCoreApplication a(argc argv); qDebug() &lt;&lt; hello ; return a.exec(); } </code></pre> <p>This basic application doesn't work when building and running in QtCreator 2.6.2. I'm using Qt 5.0.1.</p> <p>Not even my program runs; the only thing that runs is <code>qcreator_process_stub.exe</code>. In my <code>.pro</code> file the line <code>CONFIG += console</code> is there and in my <code>.pro.user</code> file <code>UseTerminal</code> is set to true.</p> <p>But my question is why my program doesn't show and what is <code>qcreator_process_stub.exe</code>?</p> <p>Edit: Standard output doesn't even show.</p>,15696222,2,7,,3/28/2013 22:05:32,,3/29/2013 1:59:32,3/28/2013 22:58:32,user569322,,user569322,,,1,2,c++|qt|qt-creator,4144
30789018,Passing Variables to a Separate PHP page (Graphics Draw),<p>I have a graphics draw image in which I would like to pass in a variable to represent the height of my image (a rectangle). The variable is part of an array that grabs the number of units in a range from a column in my database. </p> <p>I echoed the variable <code>$cred0</code> and it is displaying a number/value in my HTML page. I want to pass the variable/value to another page which draws my graphic in PHP. As of now the image is showing up fine when I set the height with a number:</p> <pre><code>define('IMAGE_WIDTH' 50); define('IMAGE_HEIGHT' 200); </code></pre> <p>But when I replace the value of the height with the variable the image does not output:</p> <pre><code>define('IMAGE_WIDTH' 50); define('IMAGE_HEIGHT' $cred0); </code></pre> <p>I am guessing the variable is not being passed into the the graphic draw .php page correctly. I have tried creating an include but that does not display the proper results. Any ideas on how I can pass this variable into another page and use it to replace the value of the height?</p> <p>This is the PHP for the page with the graphic draw (bar_chart_image.php):</p> <pre><code>&lt;?php define('IMAGE_WIDTH' 50); // width of image define('IMAGE_HEIGHT' 200); // height of image // Create the image $img = imagecreatetruecolor(IMAGE_WIDTH IMAGE_HEIGHT); // Background colors $background_color = imagecolorallocate($img 255 224 224); // pink $font_color = imagecolorallocate($img 117 109 109); // gray $line_color = imagecolorallocate($img 42 143 193); // blue $pixel_color = imagecolorallocate($img 0 0 0); // black // Fill the background imagefilledrectangle($img 0 0 IMAGE_WIDTH IMAGE_HEIGHT $background_color); // Lines for ($i = 0; $i &lt; 10; $i++) { imageline($img 0 rand() % IMAGE_WIDTH IMAGE_WIDTH rand() % IMAGE_HEIGHT $line_color); } // Random dots for($i = 0; $i &lt; 100; $i++) { imagesetpixel($img rand() % IMAGE_WIDTH rand() % IMAGE_HEIGHT $pixel_color); } // Output the image as a PNG using a header header( Content-type: image/png ); imagepng($img); imagedestroy($img); ?&gt; </code></pre> <p>This is the page that contains the variable information and values (creditLimitTable.php):</p> <pre><code>&lt;?php require_once( ./includes/database_connection.php ); error_reporting(E_ALL); ini_set('display_errors' 1); // VARIABLES FOR CREDIT LIMIT RANGES $cred0 = ''; $cred1_50000 = ''; $cred50001_75000 = ''; $cred75001_100000 =''; $cred_100000 = ''; // QUERY TO GET DATA FROM CREDIT LIMIT COLUMN $credit_limit = 'SELECT creditLimit FROM customers ORDER BY customerNumber ASC'; $result = mysqli_query($dbc $credit_limit) or die ('Error querying database'); ?&gt; &lt;!DOCTYPE html&gt; &lt;html&gt; &lt;head&gt; &lt;meta charset='utf-8'&gt; &lt;title&gt;Home&lt;/title&gt; &lt;link type= text/css rel= stylesheet href= classic_cars.css /&gt; &lt;style&gt; #table11 { height: 100px; } &lt;/style&gt; &lt;/head&gt; &lt;body&gt; &lt;p&gt;&lt;img src= bar_chart_image.php /&gt;&lt;/p&gt; &lt;?php require_once( ./includes/navigation.php ); ?&gt; &lt;h1&gt;Credit Limit Table&lt;/h1&gt; &lt;div id= table11 &gt; &lt;table border= 1 &gt; &lt;tr&gt; &lt;td&gt;Credit Limit&lt;/td&gt; &lt;/tr&gt; &lt;?php while($row = mysqli_fetch_array($result)) { $creditLimit = $row['creditLimit']; // SHOW COLUMN WITH DATA echo &lt;tr&gt; &lt;td&gt;$creditLimit&lt;/td&gt; &lt;/tr&gt; ; // ++ INCREMENT INTO ARRAY IF VALUE IN COLUMN IS WITHIN CERTAIN RANGE if($creditLimit == 0) { $cred0++; } if($creditLimit &gt;= 1 &amp;&amp; $creditLimit &lt;= 50000) { $cred1_50000++; } if($creditLimit&gt;= 50001 &amp;&amp; $creditLimit &lt;= 75000) { $cred50001_75000++; } if($creditLimit &gt;= 75001 &amp;&amp; $creditLimit &lt;= 100000) { $cred75001_100000++; } if($creditLimit &gt; 100000) { $cred_100000++; } // ARRAY $credit_data = array( array('0' $cred0) array('1 to 50000' $cred1_50000) array('50001 to 75000' $cred50001_75000) array('75001 to 100000' $cred75001_100000) array('100000' $cred_100000) ); } // end while loop ?&gt; &lt;!-- DISPLAY HOW MANY TIMES A NUMBER IN SPECIFIED RANGE SHOWS UP --&gt; &lt;p&gt;&lt;?php echo $cred0; ?&gt;&lt;/p&gt; &lt;p&gt;&lt;?php echo $cred1_50000; ?&gt;&lt;/p&gt; &lt;p&gt;&lt;?php echo $cred50001_75000; ?&gt;&lt;/p&gt; &lt;p&gt;&lt;?php echo $cred75001_100000; ?&gt;&lt;/p&gt; &lt;p&gt;&lt;?php echo $cred_100000; ?&gt;&lt;/p&gt; &lt;/table&gt; &lt;?php require_once( ./includes/footer.php ); mysqli_close($dbc); ?&gt; &lt;/body&gt; &lt;/html&gt; </code></pre>,30789238,2,8,,6/11/2015 18:47:51,,6/11/2015 19:10:53,6/11/2015 18:56:45,user4592091,,user4592091,,,1,1,php|function,63
17078386,In fortran can I type function?,<p>I want make a function as I type and read it as a function. For example if I type x+y then f(xy)=x+y. Is this possible? The following code does not work.</p> <pre><code>real function f(xy) real xy write(6*) type f(xy) read* f return end </code></pre>,17079382,2,8,,6/13/2013 1:38:21,,6/18/2013 3:31:05,6/13/2013 4:05:21,,2480756,Gobi,2480756,,1,-1,fortran,126
28607373,SQL Server 2008 query not executing properly,<p>I have to run this query on my SQL Server 2008.</p> <p>I need to join the 2 tables (<code>Gasper_object</code> and <code>Ticket</code>) and get the results where <code>Gasper_object.id</code> is also shown.</p> <pre><code>SELECT TICKET.ACTION_CODE_KEY TICKET.OBJECT_KEY GASPER_OBJECT.ID CASE WHEN ACTION_CODE_KEY IN (48) THEN 'OUT OF SERVICE' WHEN ACTION_CODE_KEY IS NULL THEN 'IN SERVICE' ELSE 'FAULTY SERVICE' END STATUS FROM TICKET INNER JOIN GASPER_OBJECT ON ticket.OBJECT_KEY = GASPER_OBJECT.OBJECT_KEY GROUP BY ticket.object_key GASPER_OBJECT.ID; </code></pre> <p>What should I do ?</p> <p><strong>UPDATE</strong></p> <p>This is what I received as a task to complete</p> <ul> <li>IF THE ACTION_CODE IS 4 OR 8 THE COLOUMN NAME SHOULD BE OUT OF SERVICE <ul> <li>OTHERWISE IT SHOULD BE FAULTY SERVICE </li> <li>IF THE OBJECT HAS NO TICKET AT ALL THEN IT'S IN SERVICE </li> <li>GASPER_OBJECT.ID STATUS SHOULD BE THE OUTPUT COLUMNS AFTER QUERYING</li> <li>IF THE OBJECT HAS MORE THAN ONE TICKET WHICH APPLIES TO THE CRITERIA USE DISTINCT</li> </ul></li> </ul>,28607868,2,9,,2/19/2015 13:14:33,,2/19/2015 13:39:33,2/19/2015 13:37:06,,13302,user4533129,,,1,0,sql|sql-server|database|join,52
29365677,How to display Bootstrap Autocloseable alert message on asp.net button click?,<p>How to display Bootstrap Autocloseable alert message on asp.net button click?</p> <p>Code as follows:</p> <pre><code> &lt;div&gt; &lt;asp:Button ID= btnLogin runat= server Text= Login CssClass= btn btn-block org Style= margin-top: 0px OnClick= btnLogin_Click showalertmsg(); ValidationGroup= Login /&gt; &lt;/div&gt; </code></pre> <p>closeable code using javascript</p> <pre><code> &lt;script type= text/javascript &gt; function showalertmsg(message alerttype) { $('#alert_placeholder').append('&lt;div id= alertdiv class= alert ' + alerttype + ' &gt;&lt;a class= close data-dismiss= alert &gt;×&lt;/a&gt;&lt;span&gt;' + message + '&lt;/span&gt;&lt;/div&gt;') setTimeout(function () { $( #alertdiv ).remove(); } 5000); } &lt;/script&gt; </code></pre> <p>I called function name showalertmsg on asp button click it gives error? error gives as follows while compiling</p> <pre><code>Compiler Error Message: CS1026: ) expected </code></pre>,29366243,2,11,,3/31/2015 9:52:50,,6/30/2015 14:52:53,6/30/2015 14:52:53,,2302862,user2860130,,,1,1,javascript|asp.net|twitter-bootstrap,365
