id,title,body,accepted_answer_id,answer_count,comment_count,community_owned_date,creation_date,favorite_count,last_activity_date,last_edit_date,last_editor_display_name,last_editor_user_id,owner_display_name,owner_user_id,parent_id,post_type_id,score,tags,view_count
8870999,Slow JavaScript animation in Chrome,<p>i have a problem with the style manipulation of an HTML object in Chrome.</p> <p>Here is an example:</p> <pre><code>var a = document.createElement('div'); a.style.position = 'absolute'; a.style.display = 'block'; a.style.top = '300px'; a.style.left = '50px'; a.style.height = '100px'; a.style.width = '10px'; a.style.backgroundColor = '#000000'; a.style.zIndex = '200'; a.aW = 10; var a2 = document.createElement('div'); a2.style.position = 'absolute'; a2.style.display = 'block'; a2.style.top = '200px'; a2.style.left = '50px'; a2.style.height = '100px'; a2.style.width = '10px'; a2.style.backgroundColor = '#000000'; a2.style.zIndex = '200'; a2.id = 'a'; a2.aW = 10; document.getElementsByTagName('body')[0].appendChild(a); document.getElementsByTagName('body')[0].appendChild(a2); var b = window.setInterval(function () { a.aW += 10; if (a.aW &gt; 1600) { window.clearInterval(b); } a.style.width = a.aW + 'px'; } 13); $('#a').animate({ width: '1600' } 2000 'linear'); </code></pre> <p>The object which is animated through the setInterval Function is sometimes working slowly if it is run on a normal website. The strange thing is that the Object animated by jQuery runs smoothly oO.</p> <p>(Sorry for my bad English).</p>,8871078,2,0,,1/15/2012 15:50:11,1,4/16/2013 15:43:49,1/15/2012 16:23:20,,225037,user1150525,,,1,3,javascript|jquery|html|firefox|google-chrome,1673
8590552,Removing duplicates from JOIN between two tables (Oracle),<p>I need to join two tables called MSISDN and RANGES. Example:</p> <pre><code>MSISDN table: MSISDN NETWORK 110011500 D000 110211501 D000 RANGES table: PREFIX NETWORK DESCRIPTION 11 D000 NEOTEL 1102 D000 TELKOM </code></pre> <p>I’m joining as: </p> <pre><code>select * from MSISDN a left join RANGES b on a.msisdn like b. prefix || '%' and a.network = b.network; </code></pre> <p>This query will give me duplicates in case as for MSISDN ‘110211501’ because it will match with both prefixes. I need to avoid these duplicates. I need to only have the match with the longest prefix (in this case ‘1102’). Is there any way how to join avoiding the duplicates or doing de duplication afterwards?</p>,8590578,2,1,,12/21/2011 13:26:35,1,12/22/2011 9:57:24,12/21/2011 13:34:31,,351982,user645438,,,1,3,sql|oracle,3376
219382,Profile User DB error in WebPart,<p><strong>EDIT:</strong> Modified title and added update.<br></p> <p><strong>UPDATE</strong>: <em>We no longer believe this is a 64bit vs 32bit problem. We have found that the only people that were seeing this were people that were set in the farm policy as full control. (Not acting as System Account) Once we tested regular users we found none had the problem. Removing the problem users from the farm policy and adding them back fixed all but one user(a fellow dev:)).</em></p> <p>We started out our Farm with 2 32bit WFE's and a 32bit Application server. We have decided to add 64bit front ends to our farm and for the most part almost everything worked fine. The exception is a custom web part that accesses the user profile database. Works fine on 32bit front end but we get the following error on the 64bit front end:</p> <blockquote> <p>User Not Found: Could not load profile data from the database. </p> <p>Description: An unhandled exception occurred during the execution of the current web request. Please review the stack trace for more information about the error and where it originated in the code. </p> <p>Exception Details: Microsoft.Office.Server.UserProfiles.UserNotFoundException: User Not Found: Could not load profile data from the database.</p> <p>Source Error: </p> <p>An unhandled exception was generated during the execution of the current web request. Information regarding the origin and location of the exception can be identified using the exception stack trace below. </p> <p>Stack Trace: </p> <p>[UserNotFoundException: User Not Found: Could not load profile data from the database.]<br /> Microsoft.Office.Server.UserProfiles.UserProfile.Load(SqlDataReader myReader Boolean bFirstRead Boolean bWssId) +930<br /> Microsoft.Office.Server.UserProfiles.UserProfile.Load(SqlDataReader myReader) +64<br /> Microsoft.Office.Server.UserProfiles.UserProfile.RetrieveUser(String strAcct Guid gAcct Byte[] bSid Nullable`1 recordId Boolean doNotResolveToMasterAccount) +1507<br /> Microsoft.Office.Server.UserProfiles.UserProfile..ctor(UserProfileManager objManager String strAcct Boolean doNotResolveToMasterAccount Boolean forceUserIsSelf) +584<br /> Microsoft.Office.Server.UserProfiles.UserProfile..ctor(UserProfileManager objManager String strAcct) +80<br /> Microsoft.Office.Server.UserProfiles.UserProfileManager.GetUserProfile(String strAccountName) +205</p> </blockquote> <p>Since the WFE is on the same farm it should be looking at the same database.</p> <p>Let me know if any more info is needed.</p> <p>Any ideas would be appreciated!</p> <p>Thanks.</p>,219456,2,2,,10/20/2008 18:25:04,1,8/14/2009 1:48:22,8/14/2009 1:48:22,AdamBT,22426,AdamBT,22426,,1,2,sharepoint|moss|wss|sharepoint-2007,3504
1218699,Error when passing an object by reference,<p>So I have a problem....<br /> <br /> I've a method<br /> void MainWindow::loadItems(const ArticleStore&amp; store)<br /> {<br /> }<br /> <br /> that I try to call like this inside the MainWindow class<br /> ArticleStore store();<br /> loadItems(store)<br /> <br /> And I get this error <br /> mainwindow.cpp:15: error: no matching function for call to ‘MainWindow::loadItems(ArticleStore (&amp;)())’ <br /> mainwindow.h:19: note: candidates are: void MainWindow::loadItems(const ArticleStore&amp;) <br /> ArticleStore definition:<br /> class ArticleStore<br /> {<br /> public:<br /> ArticleStore();<br /> };<br /> <br /> So the question is what went wrong?</p>,1218709,2,3,,8/2/2009 11:21:16,1,8/2/2009 11:27:57,8/2/2009 11:27:17,BugMagnet,,BugMagnet,,,1,1,c++|qt|reference,210
14093658,How Sessions are maintained by Server,<p>Anyone know how a web server (apache tomcat) maintains sessions ?</p> <p>I know how to create / handle and destroy sessions. What I need to know is how server maintains sessions internally.</p> <p>i.e if 10 users are connected to the server how the server identifies which session belongs to a particular user</p>,14093744,2,0,,12/30/2012 19:02:37,1,12/30/2012 19:12:10,,,,user1656168,,,1,0,apache|session|web-applications|webserver,731
434443,Duplex Callbacks or Client-Side Threading for Responsive WCF Clients,<p>I have a certain service where specific functions will take longer to call than others sometimes they might take seconds to return. In order to prevent the client's UI being blocked when this happens what is the preferred solution:</p> <ol> <li>Use a Duplex channel and simply use the callbacks to update the UI when data is received.</li> <li>Use a separate thread to call the service and simply use request-reply operations and then update the ui thread when data is returned.</li> </ol> <p>Which solution is better particularly when interoperability is favored but not strictly necessary and in your opinion which one is faster (and cleaner) to implement and maintain?</p>,435226,2,0,,1/12/2009 4:32:54,1,1/12/2009 12:05:20,,,,lozzar,49142,,1,3,wpf|wcf|multithreading|duplex,1650
621819,Multiple Domains to One Virtual Host | Wildcard Host (shared hosting)?,<p>I have the following task: Create one website which is accessible with 20 different domains names.</p> <p>Same files same folder same ip.</p> <p><strong>Question (shared hosting):</strong> Can this be accomplish with a bare cname's pointing to the same common subdomain or do we need one static ip for all?</p> <p>The problem is sure shared hosting and I'm trying to avoid creating manually cpanel addon domains one by one. Shared hosting doesn't allow to modify httpd conf which allows me to create a wildcard virtual host for an IP. </p> <p>I guess my question is auto answered; I'll need a static unless I'm only using subdomain's w wildcard which works on shared hosting. *.domain.com  two.domain.com  three.domain.com => directory/</p>,621828,2,0,,3/7/2009 13:08:52,1,3/7/2009 19:55:17,,,,Codex73,64742,,1,4,apache|website|hosting|dns,6794
214730,Ruby gem testing before deployment,<p>I'm creating a gem which has</p> <ul> <li>several scripts in the bin directory</li> <li>the utility classes in the lib directory</li> <li>and several tests in the test directory</li> </ul> <pre> supertool bin toolA toolB lib supertool supertool.rb helper.rb test tc_main.rb tc_etc.rb </pre> <p>Now to run the tests before I even install the gem I have the following snippet at the top of my tests:</p> <pre><code>base = File.basename(Dir.pwd) if base == 'test' || base =~ /supertool/ Dir.chdir('..') if base == 'test' $LOAD_PATH.unshift(Dir.pwd + '/lib') Dir.chdir('test') if base =~ /supertool/ end </code></pre> <p>This seems tedious though especially if I have to put these in the scripts in the bin directory too. Is there a better way of setting up the environment so we can test gems before they are installed? I'm sure it's something simple that I just can't find. A simple link to the right place would help a lot :)</p>,259783,2,1,,10/18/2008 7:55:52,1,11/3/2008 20:14:06,,,,moogs,26374,,1,2,ruby|testing|gem,2567
674643,Align radio button with corresponding label,<p>I'm using ASP.NET radio button list control. </p> <p>It generates the following HTML. </p> <pre><code> &lt;table&gt; &lt;tr&gt; &lt;td&gt; &lt;input type= radio /&gt; &lt;label &gt; label 1&lt;/label&gt; &lt;/td&gt; &lt;td&gt; &lt;input type= radio value= False checked= checked /&gt; &lt;label &gt; label 2&lt;/label&gt;&lt;/td&gt; &lt;/tr&gt; &lt;/table&gt; </code></pre> <p>Everything looks fine so far(at least to the user) labels are aligned with radio buttons. </p> <p>However when I resize the font to say 10px the size of the label obviously looks smaller but the side-effect of that is that the label also looks like it is aligned to the bottom of a radio button. I need a label to be alligned to middle of a radio button. </p> <p>I was able to do this in IE with the following css:</p> <pre><code> &lt;style type= text/css &gt; label { font-size:10px; line-height:12px; vertical-align:middle; } &lt;/style&gt; </code></pre> <p>However this doesn't work in Firefox or Chrome</p> <p>Any suggestions?</p>,674660,2,1,,3/23/2009 18:27:36,1,11/26/2011 4:18:44,,,,dev.e.loper,37759,,1,14,asp.net|css,34120
86800,Is the syntax for the Wordpress style.css template element available anywhere?,<p>I've recently embarked upon the <em>grand voyage</em> of Wordpress theming and I've been reading through the Wordpress documentation for how to write a theme. One thing I came across <a href= http://codex.wordpress.org/Theme_Development rel= nofollow >here</a> was that the <code>style.css</code> file must contain a specific header in order to be used by the Wordpress engine. They give a brief example but I haven't been able to turn up any formal description of what must be in the <code>style.css</code> header portion. Does this exist on the Wordpress site? If it doesn't could we perhaps describe it here?</p> <p>Thanks in advance!</p>,86860,2,2,,9/17/2008 19:39:00,1,9/18/2008 1:41:11,,,,stopsineman,16562,,1,1,wordpress|wordpress-theming|css,2855
20800433,CKEditor Hyperlink does not create links,<p>I create hyperlinks in CKEditor using url dialog but it does not produce link as expected.</p> <p>For instance I select the work My Gallery in the editor and then click on hyperlink dialog and in the popped up box I type www.google.com and then save it. But when I view the page the link for the word My Gallery is created as follows:</p> <pre><code>http://iranamoozeshgah.com/%5C%22www.google.com%5C%22 </code></pre> <p>And the created markup:</p> <pre><code>&lt;a href= \ www.google.com\ &gt; &lt;em&gt;My Gallery&lt;/em&gt; &lt;/a&gt; </code></pre>,20825829,2,2,,12/27/2013 12:05:25,1,12/29/2013 13:55:49,,,,user2739275,,,1,1,javascript|jquery|html|hyperlink|ckeditor,970
8107192,How to make a deep copy of a rectangular region of a cv::Mat?,<p>Using opencv 2.3. I have a region bounded by a rectangle that I want to extract and make a deep copy of so that when that image is destroyed this rectangular region can live on. I'm using this as a template for matching in a video sequence. How can you do that?</p>,8110695,2,2,,11/12/2011 20:04:31,1,11/13/2011 11:48:18,,,,user189320,,,1,2,c++|opencv,5343
6404038,Can I inject javascript code from the address bar int a flash video,<p>With regular HTML it's possible to change the look of the page and to make new cookies using javascript simply by typing it into the address bar and hitting enter.But what about flash videos.Is there a way to preform some action on the video on the page using javascript in the address bar?</p>,6404111,2,7,,6/19/2011 17:41:31,1,6/19/2011 18:09:38,,,,user744186,,,1,1,javascript|flash,681
1107811,How to render the iphone device screens on mac OS or in windows,<p>We have an iphone device in our company and for the remote demo purpose I have to show some of the device specific features like voice call accelerometer etc. (which is not possible on a iphone simulator) from a mac / windows system. Is there any way to render the device screens on mac /windows machine?</p> <p>Advance Thanks Sathish</p>,1107946,3,0,,7/10/2009 5:13:05,1,7/14/2009 16:22:50,7/10/2009 5:30:51,,53166,Sathish,,,1,1,iphone|ios-simulator,191
29855,Is there a wxWidgets framework for C?,<p>My understanding is that <a href= http://www.wxwidgets.org rel= nofollow >wxWidgets</a> is for a number of programming languages (C++ Python Perl and C#/.NET) but that does not include C. Is there a similar framework for the C programming language or is this not something that C is used for?</p>,29859,3,0,,8/27/2008 10:21:16,1,3/27/2015 9:18:10,8/27/2008 12:32:38,tj9991,1662,DavidM,2183,,1,2,c|user-interface,4168
288687,How to fade an NSSound object,<p>I've written a cheap &amp; cheerful sound board in for my Mac and I play the various sounds with NSSound like this:</p> <pre><code>-(void)play:(NSSound *)soundEffect:(BOOL)stopIfPlaying { BOOL wasPlaying = FALSE; if([nowPlaying isPlaying]) { [nowPlaying stop]; wasPlaying = TRUE; } if(soundEffect != nowPlaying) { [soundEffect play]; nowPlaying = soundEffect; } else if(soundEffect == nowPlaying &amp;&amp; ![nowPlaying isPlaying] &amp;&amp; !wasPlaying) { [nowPlaying play]; } } </code></pre> <p>Rather than just stop it dead I'd like it to fade out over a couple of seconds or so.</p>,294399,3,0,,11/13/2008 23:01:50,1,11/19/2008 17:06:50,11/14/2008 4:29:23,Ned Batchelder,14343,Stuart Grimshaw,11470,,1,5,objective-c|nssound,903
545163,Is there a data sizer tool available for SQL Server 2005?,<p>I have to estimate the data size of database when populated with forecast values for each table. It should at least include size to be used for data and indexes.</p> <p>There used to be tool like this in SQL Server 2000 that produced an estimated size when supplied with the amount of records per table (I think it shipped with the SQL 2000 resource kit). I can neither find this tool for 2000 or 2005 :(</p> <p>I know about sp_spacedused but that is not going to work for me as I have to pre-populate the database with values and I have potentially many scenarios to calculate.</p>,546989,3,0,,2/13/2009 8:26:48,1,11/1/2015 23:47:04,11/1/2015 23:47:04,John Sansom,4370109,Philip Fourie,11123,,1,5,sql-server|database|database-design|sizing,721
242752,Force application to shut down (.net),<p>I'm looking to force my application to shut down and return an Exit code. Had a look on MSDN and I can see that in WPF the Application has a Shutdown method which takes an error code as a parameter but there doesn't appear to be one for System.Windows.Forms.Application.</p> <p>I can see Application.Exit() but not a way to pass back an error code.</p> <p>Does anyone know off-hand if this is possible?</p> <p>Thanks</p>,242758,3,0,,10/28/2008 10:13:36,1,12/5/2008 14:31:23,12/5/2008 14:31:23,Michal Sznajder,501,Duncan,7140,,1,7,.net|shutdown,3889
1287532,Is it possible to take two rows and concatenate them in MySQL?,<p>I have two rows of data and I would like to know if it is possible to put all results in a single row?</p> <pre><code>1 var1 var2 2 var4 var5 </code></pre> <p>to</p> <pre><code>1 var1 var2 var4 var5 </code></pre> <p>Thanks!</p>,1287541,3,3,,8/17/2009 11:51:32,1,8/17/2009 12:03:43,8/17/2009 11:56:12,,4023,jim,,,1,0,mysql,156
585595,HTTP Connection Pooling in GlassFish,<p>In my webservice I need to place some HTTP calls. Is it possible to do some connection pooling like I do JDBC connection pooling? </p> <p>In the Admin Console of GlassFish I see the configuration items <code>Connector Connection Pool</code> and <code>Connector Resources</code>. Can I use these?</p>,606643,3,0,,2/25/2009 11:05:53,1,8/3/2012 2:31:37,,,,doekman,56,,1,0,java|http|java-ee|glassfish,2448
681226,Class Diagram for classless PHP application,<p>I have PHP application that is completely procedural (No PHP Classes). In my case is there any formal diagrams I can draw to show how my web application that is equivalent to a UML class diagram for OOP based applications.</p> <p>Thanks all</p>,681354,3,0,,3/25/2009 11:46:01,1,3/25/2009 12:35:43,,,,Abs,51649,,1,1,php|oop|uml,965
218578,Visual Studio jscript intellisense error with jQuery 1.2.6?,<p>I get the warning childNodes is null or not an object' with different line numbers depending on which version of the library I reference (I've tried about three different versions of 1.2.6). Consequently I get jack for jQuery intellisense.</p> <p>I can hack this to get it to work but I'd rather not as I don't understand the full implications of changing the following line:</p> <pre><code>elem = jQuery.makeArray(div.childNodes); </code></pre> <p>to this:</p> <pre><code>//HACK: VS intellisense fix if(div &amp;&amp; div.childNodes) elem = jQuery.makeArray(div.childNodes); </code></pre> <p>(The changed line only appears once in the source). What gives?</p>,218678,3,0,,10/20/2008 14:10:47,1,2/26/2009 13:21:58,,,,Will,1228,,1,2,asp.net|jquery|intellisense,3447
600770,Should I save strings returned by NSLocalizedString()?,<p>I'm working on an iPhone app that we're localizing in both English and Japanese for our initial release. We frequently call <code>NSLocalizedString()</code> to load the appropriate localized string for display. Is it generally better to save the localized strings in instance variables for the next time we need them or am I micro-optimizing here and should I just reload the string each time it's needed?</p>,600838,3,0,,3/1/2009 23:11:34,1,3/1/2009 23:36:47,,,,Don McCaughey,65764,,1,5,iphone|cocoa|cocoa-touch,1645
7132907,Incremental Database development in Entity framework code first,<p>How can I do incremental developments with entity framework code first database. Because if I change something i model classes it will regenerate the database which cased to loss my data already in the database. I'm using <code>DropCreateDatabaseIfModelChanges</code> . Is there any thing other than that to execute alter quires rather than recreating.</p>,7133941,3,0,,8/20/2011 15:59:36,1,8/20/2011 18:53:20,,,,user890229,,,1,7,entity-framework|entity-framework-4.1|ef-code-first,717
543570,getopt() in VC++,<p>I'm quite fond of using GNU <a href= http://www.gnu.org/software/libtool/manual/libc/Getopt.html ><b>getopt</b></a> when programming under <strong>Linux</strong>. I understand that getopt() is not available under MS VC++.</p> <p><strong>Note:</strong></p> <ul> <li>Win32 environment</li> <li>using Visual Studio</li> <li>No <a href= http://www.boost.org/ >Boost</a></li> <li>No MFC</li> <li>Not concerned with portability</li> </ul> <p><strong>Question:</strong></p> <ul> <li>How can I then port getopt() accordingly? <ul> <li>What guidelines should I be aware of while porting?</li> </ul></li> <li>Known port with <strong>same</strong> features?</li> </ul>,546575,3,0,,2/12/2009 21:56:43,1,2/14/2011 23:49:13,,,,Atklin,51078,,1,11,c++|windows|visual-studio-2008,13171
368832,Character encoding problem - PHP output read by .NET via HttpWebRequest,<p>I have a PHP script (running on a Linux server) that ouputs the names of some files on the server. It outputs these file names in a simple text-only format.</p> <p>This output is read from a VB.NET program by using HttpWebRequest HttpWebResponse and a StreamReader.</p> <p>The problem is that some of the file names being output contain... unusual characters. Specifically the section symbol (§). </p> <p>If I view the output of the PHP script in a web browser the symbol appears fine.</p> <p>But when I read the output of the PHP script into my .NET program the symbol doesn't appear correctly (it appears as a generic block symbol). </p> <p>I've tried all the different character encoding options that you can use when reading the response stream (from the HttpWebResponse). I've tried outputting the stream directly to a text file (no good) displaying it in a TextBox (no good) and even when viewing the results directly in the Visual Studio debugger the character appears as a block instead of as the section symbol. </p> <p>I've examined the output in a hex editor (as suggested by a related question <a href= http://stackoverflow.com/questions/29499/how-do-you-troubleshoot-character-encoding-problems >how do you troubleshoot character encoding problems</a>. </p> <p>When I write out the section symbol (§) from .NET itself the hex bytes I see representing it are c2 a7 (makes sense if it's unicode right? requires two bytes?). When I write out the output from the PHP script directly to a file and examine that with a hex editor the symbol shows up as ef bf bd - three bytes instead of two?</p> <p>I'm at a loss as to what to do - if I need to specify some other character encoding or if I'm missing something obvious about this. </p> <p>Here's the code that's used to get the output of the PHP script (VB-style comments modified so they appear correctly on this site):</p> <pre><code> Dim myRequest As HttpWebRequest = WebRequest.Create( http://www.example.com/sample.php ) Dim myResponse As HttpWebResponse = myRequest.GetResponse() // read the response stream Dim myReader As New StreamReader(myResponse.GetResponseStream()) // read the entire output in one block (just as an example) Dim theOutput as String = myReader.ReadToEnd() </code></pre> <p>Any ideas? </p> <ul> <li>Am I using the wrong kind of StreamReader? (I've tried passing the character encoding in the call to create the new StreamReader - I've tried all the ones that are in System.Text.Encoding - UTF-8 UTF-7 ASCII UTF-32 Unicode etc.)</li> <li>Should I be using a different method for reading the output of the PHP script? </li> <li>Is there something I should be doing different on the PHP-side when outputting the text?</li> </ul> <p><strong>UPDATED INFO:</strong></p> <ul> <li>The output from PHP is specifically encoded UTF-8 by calling: <code>utf8_encode($file);</code></li> <li>When I wrote out the symbol from .NET I copied and pasted the symbol from the Character Map app in Windows. I also copied &amp; pasted it directly from the file's name (in Windows) and from this web page itself - all gave the same hex value when written out (c2 a7).</li> <li>Yes the section symbol I'm talking about is U+00A7 (ALT+0167 on Windows according to Character Map).</li> <li>The content-type is set explicitly via <code>header('Content-Type: text/html; charset=utf-8');</code> right at the beginning of the PHP script.</li> </ul> <p><strong>UPDATE:</strong></p> <p>Figured it out myself but I couldn't have done it without the help from the people who answered. Thank you!</p>,369117,4,0,,12/15/2008 16:02:52,1,2/6/2012 15:10:57,12/15/2008 17:55:25,Keithius,5956,Keithius,5956,,1,2,.net|php|vb.net|encoding|character-encoding,5858
239526,truncate output in BASH,<p>How do I truncate output in BASH? </p> <p>For example if I du file.name how do I just get the numeric value and nothing more?</p> <p>later addition:<br /> all solutions work perfectly. I chose to accept the most enlightning cut answer because I prefer the simplest approach in bash files others are supposed to be able to read.</p>,239532,4,0,,10/27/2008 10:35:44,1,10/27/2008 12:59:40,10/27/2008 10:49:51,Amir Arad,11813,Amir Arad,11813,,1,6,linux|bash,5640
638290,In SQL how can I convert a money datatype to a decimal?,<p>I want to convert a money datatype to a decimal because I want to record the results to 8 decimal places.</p> <p>For example in a currency rate table I see the rate stored as 2871047428.20 as a money datatype; using Microsoft SQL Management Studio I want to divide that by 10000000 in order to achieve the result 287.10474282; however the result I am actually getting is 287.1047.</p> <p>I believe the reason I am getting only the 4 decimal places is because it is money datatype and therefore I think the way forward is to convert this to a decimal datatype.... </p>,638373,4,0,,3/12/2009 11:53:31,1,11/13/2012 0:47:05,3/12/2009 12:22:05,splattne,6461,JKem,,,1,7,sql|types|decimal|money,39779
6816791,The differences between free in C and delete in C++?,<p>I know the free operation in <strong>C</strong> is to tell the compiler this particular memory block is free for compiler to use for further allocation but the memory is not released.</p> <p>What about the delete in C++? the same as free?</p>,6816851,4,3,,7/25/2011 13:23:34,1,8/10/2015 17:50:36,8/10/2015 17:50:36,,4370109,user707549,,,1,2,c|free|delete-operator,7331
