id,title,body,accepted_answer_id,answer_count,comment_count,community_owned_date,creation_date,favorite_count,last_activity_date,last_edit_date,last_editor_display_name,last_editor_user_id,owner_display_name,owner_user_id,parent_id,post_type_id,score,tags,view_count
525063,Android Respond To URL in Intent,<p>I want my intent to be launched when the user goes to a certain url: for example the android market does this with <a href= http://market.android.com/ >http://market.android.com/</a> urls. so does youtube. I want mine to do that too.</p>,525086,1,2,,2/8/2009 2:55:57,65,4/10/2016 3:28:10,8/15/2015 10:24:13,,1529129,Isaac Waller,764272,,1,132,android|url|android-intent|intentfilter|launch,91060
14128723,Eclipse -- Progress windows don't show up any more,<p>I used to see both Building and Cleaning actions in their own separate windows where I could wait for them to complete before continuing. Several weeks ago I must have clicked Run in Background  because now the progress only appears in a small obscured Progress view.</p> <p><img src= http://i.stack.imgur.com/Ik1x8.gif alt= Not so nice. ></p> <p>How do I set the progress of things like Java Build and Clean to appear in a popup dialog again?</p> <p><img src= http://i.stack.imgur.com/PtQsk.gif alt= Nice. ></p>,14128762,1,0,,1/2/2013 20:31:54,4,1/2/2013 20:34:55,,,,user1499731,,,1,13,java|eclipse,4272
20728,What's the best way to create ClickOnce deployments,<p>Our team develops distributed winform apps. We use ClickOnce for deployment and are very pleased with it.</p> <p>However we've found the pain point with ClickOnce is in <em>creating</em> the deployments. We have the standard dev/test/production environments and need to be able to create deployments for each of these that install and update separate from one another. Also we want control over what assemblies get deployed. Just because an assembly was compiled doesn't mean we want it deployed.</p> <p>The obvious first choice for creating deployments is Visual Studio. However VS really doesn't address the issues stated. The next in line is the SDK tool Mage. Mage works OK but creating deployments is rather tedious and we don't want every developer having our code signing certificate and password.</p> <p>What we ended up doing was rolling our own deployment app that uses the command line version of Mage to create the ClickOnce manifest files.</p> <p>I'm satisfied with our current solution but is seems like there would be an industry-wide accepted approach to this problem. Is there?</p>,20806,2,0,,8/21/2008 18:35:04,5,11/30/2015 2:03:49,11/30/2015 2:03:49,,1321,whatknott,1321,,1,13,winforms|deployment|clickonce,2534
6531409,iOS: how to get image dimensions without opening it,<p>In an iOS app I need to provide image filters based on their size (width/height) think of something similar to Large Medium Small in Google images search. Opening each image and reading its dimensions when creating the list would be very performance intensive. Is there a way to get this info without opening the image itself?</p> <p>Damien DeVille answered the question below based on his suggestion I am now using the following code:</p> <pre><code>NSURL *imageURL = [NSURL fileURLWithPath:imagePath]; if (imageURL == nil) return; CGImageSourceRef imageSourceRef = CGImageSourceCreateWithURL((CFURLRef)imageURL NULL); if(imageSourceRef == NULL) return; CFDictionaryRef props = CGImageSourceCopyPropertiesAtIndex(imageSourceRef 0 NULL); CFRelease(imageSourceRef); NSLog(@ %@  (NSDictionary *)props); CFRelease(props); </code></pre>,8731972,2,2,,6/30/2011 7:33:39,4,4/22/2014 17:16:44,1/24/2012 7:37:04,user83950,,user83950,,,1,7,ios4|uikit,2837
593205,action delegate with zero parameters,<p>I see this line in many online examples of using the Action delegate:</p> <pre><code>public event Action MyEvent; </code></pre> <p>But when I try it in my own code I get this error</p> <blockquote> <p>Using the generic type 'System.Action' requires '1' type arguments</p> </blockquote> <p>The documentation certainly describes a form of Action without any type parameter. What am I missing?</p>,593223,2,3,,2/27/2009 1:30:28,6,1/12/2012 1:44:40,1/12/2012 1:44:40,,8677,I. J. Kennedy,8677,,1,21,c#|delegates|action,12377
377901,JAX-WS authentication against a database,<p>I'm implementing a JAX-WS webservice that will be consumed by external Java and PHP clients.</p> <p>The clients have to authenticate with a username and password stored in a database per client.</p> <p>What authentication mechanism is best to use to make sure that misc clients can use it?</p>,459330,3,0,,12/18/2008 13:51:40,6,1/31/2012 9:05:55,9/23/2011 11:31:02,,157762,Gunnar Steinn,33468,,1,4,java|web-services|security,7568
638886,Java Applet z-index on Safari and beyond,<p>A well known problem with Java Applets in webpages is that browsers ignore the z-index of the applet tag vs. other components in the page. No matter how you position and z-index elements in the page applets will draw themselves on top of everything.</p> <p>There is a workaround known as the iframe shim as described here: <a href= http://www.oratransplant.nl/2007/10/26/using-iframe-shim-to-partly-cover-a-java-applet/ rel= nofollow >http://www.oratransplant.nl/2007/10/26/using-iframe-shim-to-partly-cover-a-java-applet/</a>.</p> <p>However this workaround does not work in Safari 3 or 4 in Windows (assuming the same for Mac).</p> <p>Does anyone know a way to make it work in Safari? </p> <p>Does anyone have ideas about how to pressure Sun to fix the underlying problem so we can avoid clumsy shims? Here is a bug report on the issue <a href= http://bugs.sun.com/bugdatabase/view_bug.do?bug_id=6646289 rel= nofollow >http://bugs.sun.com/bugdatabase/view_bug.do?bug_id=6646289</a> notice that it has been open for a year however other bug reports go back many many years.</p> <p>This is so frustrating don't Sun understand that this is the very sort of thing that has marginalized Java as a way of doing cool stuff in the browser? I love you Java but you are not helping your situation...</p>,1393541,3,0,,3/12/2009 14:34:14,4,11/15/2013 5:25:10,11/15/2013 4:47:58,,114029,jwlrs,77244,,1,6,java|html|applet|overlay|z-index,12116
235982,How Code Color is Set in StackOverflow?,<p>The most favorite feature of StackOverflow for me is that it can automatically detect code in post and set appropriate color to the code.</p> <p>I'm wondering how the color is set. When I do a <kbd>Ctrl</kbd>+<kbd>F5</kbd> on a page the code seems first be black text then change to be colorful. Is it done by jQuery?</p>,236062,3,0,,10/25/2008 6:03:40,10,2/22/2014 22:42:37,2/22/2014 22:42:37,,2581872,Morgan Cheng,26349,,1,12,javascript|syntax-highlighting,1284
687884,What is the correct way of using the Guid type in a XSD file?,<p>I have a .xsd file which I use to generate code with the xsd.exe tool from Visual Studio. Some class members are Guids and the xsd.exe tool gives 2 warnings:</p> <p>Namespace '<a href= http://microsoft.com/wsdl/types/ >http://microsoft.com/wsdl/types/</a>' is not available to be referenced in this schema. Type '<a href= http://microsoft.com/wsdl/types/:guid >http://microsoft.com/wsdl/types/:guid</a>' is not declared.</p> <p>The Guid type is recognized because the generated C# file is valid and works. Anyone knows how to get rid of those warnings?</p> <p>What is the correct syntax for the XSD to be validated AND class members being generated as System.Guid?</p>,723045,3,0,,3/26/2009 23:02:47,5,3/17/2014 16:40:07,3/27/2009 17:32:31,Kovey,46832,Kovey,46832,,1,17,xsd|guid|xsd.exe,20808
373234,How can I grab my local changelist and send it to someone else in Perforce?,<p>How can I grab my local changelist and send it to someone else in Perforce? More specifically I would like to send unsubmitted changes from a local pending changelist to another user's pending changelist.</p>,373434,3,1,,12/17/2008 0:04:08,4,10/19/2015 23:35:57,10/19/2015 23:35:57,,46869,WJ B,46869,,1,13,perforce,5995
11318,Simple animation in WinForms,<p>Imagine you want to animate some object on a WinForm. You setup a timer to update the state or model and override the paint event of the Form. But from there what's the best way to continually repaint the Form for the animation?</p> <ul> <li>Invalidate the Form as soon as you are done drawing?</li> <li>Setup a second timer and invalidate the form on a regular interval?</li> <li>Perhaps there is a common pattern for this thing?</li> <li>Are there any useful .NET classes to help out?</li> </ul> <p>Each time I need to do this I discover a new method with a new drawback. What are the experiences and recommendations from the SO community?</p>,11404,3,0,,8/14/2008 16:44:42,9,6/19/2012 9:20:50,,,,Chris Smith,322,,1,18,.net|winforms|animation,14991
520030,Why is there no Linq method to return distinct values by a predicate?,<p>I want to get the distinct values in a list but not by the standard equality comparison.</p> <p>What I want to do is something like this:</p> <pre><code>return myList.Distinct( (x y) =&gt; x.Url == y.Url ); </code></pre> <p>I can't there's no extension method in Linq that will do this - just one that takes an <code>IEqualityComparer</code>.</p> <p>I can hack around it with this:</p> <pre><code>return myList.GroupBy( x =&gt; x.Url ).Select( g =&gt; g.First() ); </code></pre> <p>But that seems messy. It also doesn't quite do the same thing - I can only use it here because I have a single key.</p> <p>I could also add my own:</p> <pre><code>public static IEnumerable&lt;T&gt; Distinct&lt;T&gt;( this IEnumerable&lt;T&gt; input Func&lt;TTbool&gt; compare ) { //write my own here } </code></pre> <p>But that does seem rather like writing something that should be there in the first place.</p> <p>Anyone know why this method isn't there?</p> <p>Am I missing something?</p>,520046,3,0,,2/6/2009 11:51:53,15,10/8/2010 18:29:27,,,,Keith,905,,1,42,c#|linq|distinct,10620
15301999,Python 2.x - default arguments with *args and **kwargs,<p>In <strong>Python 2.x</strong> (I use 2.7) which is the proper way to use default arguments with <code>*args</code> and <code>**kwargs</code>?<br> I've found a question on SO related to this topic but that is for <strong>Python 3</strong>:<br> <a href= http://stackoverflow.com/questions/9872824/calling-a-python-function-with-args-kwargs-and-optional-default-arguments >Calling a Python function with *args**kwargs and optional / default arguments</a></p> <p>There they say this method works:</p> <pre><code>def func(arg1 arg2 *args opt_arg='def_val' **kwargs): #... </code></pre> <p>In 2.7 it results in a <code>SyntaxError</code>. Is there any recommended way to define such a function?<br> I got it working this way but I'd guess there is a nicer solution.</p> <pre><code>def func(arg1 arg2 *args **kwargs): opt_arg ='def_val' if kwargs.__contains__('opt_arg'): opt_arg = kwargs['opt_arg'] #... </code></pre>,15302042,3,5,,3/8/2013 19:43:13,8,2/8/2016 17:38:04,,,,user1563285,,,1,31,python|python-2.7,7299
216694,Structuring a winforms C# solution,<p>So i am reorganizing a winforms C# solution to help decouple and make it cleaner and more organized. The solution tracks a small business ordersetc . .</p> <p>I have broken out the projects so far into</p> <p><strong>App.View</strong> - all GUI Related Code<br /> <strong>App.Data</strong> - just data structures and interfaces. No other implementation code<br /> <strong>App.BusinessLogic</strong> - all business logic code that has no GUI references</p> <p>I have some classes that i can't figure out where they belong. Please let me know your thoughts which project each class should go or if there is another project that should get created for this.</p> <ol> <li>A Class that retrieves user preferences from a database</li> <li>A Class that retrieves static data from our static data server and returns sets of data results.</li> <li>A Class that brings down user entitlements</li> <li>A model class that stores a hashtable of orders</li> <li>A class that emails out messages on a user action</li> </ol>,216736,4,0,,10/19/2008 17:20:19,5,10/20/2008 0:04:12,10/19/2008 17:26:12,akantro,4653,akantro,4653,,1,6,c#|winforms|model-view-controller|mvp|projects,2873
395321,Is it Possible to Make a Generic Control in .Net 3.5?,<p>I've got the following Generic usercontrol declared:</p> <pre><code>public partial class MessageBase&lt;T&gt; : UserControl { protected T myEntry; public MessageBase() { InitializeComponent(); } public MessageBase(T newEntry) { InitializeComponent(); myEntry = newEntry; } } } </code></pre> <p>But the compiler won't allow me to do this:</p> <pre><code>public partial class MessageControl : MessageBase&lt;Post&gt; { public MessageControl() { InitializeComponent(); } } </code></pre> <p>How do I create a generic user control in C#?</p>,395446,4,0,,12/27/2008 19:32:46,5,11/29/2010 12:57:57,11/29/2010 12:57:57,Roberto Bonini,16587,Roberto Bonini,5648,,1,9,c#|.net|winforms|generics|user-controls,5716
125632,Is it possible to link to a bookmark within a PDF using URL parameters?,<p>When providing a link to a PDF file on a website is it possible to include information in the URL (request parameters) which will make the PDF browser plugin (if used) jump to a particular bookmark instead of just opening at the beginning?</p> <p>Something like: <a href= http://www.somehost.com/user-guide.pdf?bookmark=chapter3 >http://www.somehost.com/user-guide.pdf?bookmark=chapter3</a> ?</p> <p>If not a bookmark would it be possible to go to a particular page?</p> <p>I'm assuming that if there is an answer it may be specific to Adobe's PDF reader plugin or something and may have version limitations but I'm mostly interested in whether the technique exists at all.</p>,125650,4,0,,9/24/2008 6:02:15,18,1/14/2016 1:03:12,7/17/2012 5:54:58,,11343,Chris Carruthers,1119,,1,64,url|pdf|hyperlink|bookmarks,66619
927806,SVN checkout the contents of a folder not the folder itself,<p>I'm fairly new to linux and svn. I'm trying to checkout the trunk folder of a project into my public_html directory using this command (while in public_html):</p> <pre><code>svn checkout file:///home/landonwinters/svn/waterproject/trunk </code></pre> <p>The waterproject directory contains the files from untarring a base install of drupal.</p> <p>It checks out fine except all the files are in <code>public_html/trunk</code> instead of just being in <code>public_html</code>.</p> <p>I don't know the command to move all the contents of trunk up to public_html and rm trunk but I think I could figure that out relatively easily. I just want to know if I can just check out the contents of a folder without the folder itself.</p>,927821,4,0,,5/29/2009 19:48:14,30,4/29/2016 19:58:24,9/13/2011 9:02:22,,400925,user114518,,,1,112,linux|svn|checkout,78376
335279,Windows/.NET way to monitor/debug the serial port?,<p>I have an application which is .NET 2.0 running on Windows XP Professional. This app uses the Serial Port to communicate with some custom devices.</p> <p>For some reason a few of our custom built PCs have an issue with the Serial Port where it will stop functioning after a few weeks of use. Other that auto-reboots which won't work in my scenario are there any utilities out there which can debug/diagnose the serial port? Is there any .NET library which can help with this (can I write my own utility to debug the port)?</p> <p>Also has anyone had any experience with the following library: <a href= http://www.sax.net/commstudio rel= nofollow >Sax CommStudio</a></p>,335545,4,0,,12/2/2008 20:19:15,4,9/8/2011 13:28:06,,,,pearcewg,24126,,1,4,.net|windows|serial-port|lockup,4336
421458,Anonymous users in Rails -- security considerations?,<p>I'm looking at implementing some form of anonymous user system in Rails. I need to let people do things (creating records looking at what they've created etc) without actually creating an account. Once they create an account everything persists without risk of losing it by clearing cookies or something.</p> <p>Right now I'm thinking it's pretty straightforward. Have an is_anonymous field in the User model and use something like this to access the currently logged in user:</p> <pre><code>def find_user session[:user_id] ||= create_new_anonymous_user.id end </code></pre> <p>Assuming the session persists for some reasonable period of time and the session cookie doesn't expire that should keep everything running smoothly.</p> <p>However there is this piece of me that is convinced that I'm missing something security-related. Has anyone done something like this before? Am I missing something super-obvious?</p> <p>Thanks!</p>,430559,4,0,,1/7/2009 18:29:37,6,10/13/2009 15:53:30,,,,Tim Sullivan,722,,1,7,ruby-on-rails|ruby|security|anonymous-users,1208
6513461,How do I get the Video Id from the URL? (DailyMotion),<p>Example: </p> <pre><code>http://www.dailymotion.com/video/x4xvnz_the-funny-crash-compilation_fun </code></pre> <p>How do I get <code>x4xvnz</code>?</p>,6513505,5,0,,6/28/2011 21:46:06,5,9/28/2015 20:35:16,6/28/2011 21:48:51,,218196,user317005,,,1,6,php|regex|preg-match,10301
366517,What is the best resource for learning the features and benefits of windbg?,<p>What is the best resource for learning the features and benefits of windbg? I want to be able to discuss investigate memory issues (handles objects) performance issues etc . . .</p>,366583,6,0,,12/14/2008 12:55:17,9,12/17/2008 22:16:44,12/14/2008 19:29:29,EndangeredMassa,106,ak,4653,,1,4,c#|debugging|windbg,442
586829,Change Color of Button in DataGridView Cell,<p>I have a large DataGridView control that has several cells most of which contain a button. How can I change the color of those buttons?</p> <p>This changes the outline of the button but not the button itself.</p> <pre><code>row.Cells[2].Style.BackColor = System.Drawing.Color.Red; </code></pre> <p>This doesn't seem to change anything that's visible:</p> <pre><code>row.Cells[2].Style.ForeColor = System.Drawing.Color.Red; </code></pre> <p>If it's not possible to change the background is it possible to change the font on the button?</p> <p>Using .NET 2.0.</p>,587365,6,0,,2/25/2009 16:51:32,4,8/2/2013 18:24:57,2/25/2009 17:20:28,Tomas Pajonk,4694,Dave,35229,,1,12,c#|.net|winforms|.net-2.0,28455
461836,Arduino C++ code: can you use virtual functions and exceptions?,<p>Following up on <a href= http://stackoverflow.com/questions/452139/writing-firmware-assembly-or-high-level#452401 >this comment</a> from the question <a href= http://stackoverflow.com/questions/452139/writing-firmware-assembly-or-high-level >Writing firmware: assembly or high level?</a>: </p> <p>When compiling C++ code for the <a href= http://arduino.cc rel= nofollow >Arduino</a> platform can you use virtual functions exceptions etc? Or would you want to (have to) use a subset of C++ (as described in <a href= http://stackoverflow.com/questions/452139/writing-firmware-assembly-or-high-level#452401 >the comment</a>)?</p> <p>Any other caveats when programming for the Arduino platform? </p>,727836,6,0,,1/20/2009 15:44:47,9,3/5/2013 13:22:40,3/5/2013 13:22:40,,4023,brulak,29505,,1,14,c++|arduino|virtual-functions|firmware,9739
333271,Good resources for learning Factor,<p>Having recently come across <a href= http://elasticdog.com/2008/11/beginning-factor-introduction/ >this introduction to Factor</a> I've been a bit curious to learn more. Aside from the official FAQ mentioned there do you have resources for learning the language (as well as the stack-based paradigm if that's the right word) that you've found helpful?</p> <p>As a side note would learning Forth help or is that like comparing C to Python (or what have you)?</p>,338226,6,0,,12/2/2008 7:38:08,18,12/14/2014 15:22:37,12/14/2014 15:22:37,J Cooper,847099,J Cooper,38803,,1,26,factor-lang,3466
267256,Combining multiple SVN repositories into one,<p>After considering the answers to my previous question (<a href= http://stackoverflow.com/questions/252459/one-svn-repository-or-many >One SVN Repository or many?</a>) I've decided to take the 4 or so repositories I have and consolidate them into one. This of course leads to the question <strong>what's the best way to do this?</strong></p> <p>Is there a way to combine two or more repositories maintaining the version history for both?</p> <p>Edit: <em>I should also point out that I'm using Assembla.com which does not provide access to the svnadmin command AFAIK</em></p> <p>Another edit: <em>Does this even matter? If svnadmin works on URLs then it's no problem then.</em></p>,267307,6,1,,11/6/2008 0:18:57,34,5/28/2015 20:31:31,11/6/2008 0:48:51,nickf,9021,nickf,9021,,1,49,svn,36842
490618,Multiple javascript/css files: best practices?,<p>I have about 7 Javascript files now (thanks to various jQuery plugins) and 4-5 CSS files. I'm curious as to what's the best practice for dealing with these including where in the document they should be loaded? YSlow tells me that Javascript files should be--where possible--included at the end. The end of the body? It mentions that the delimeter seems to be whether they write content. All my Javascript files are functions and jQuery code (all done when ready()) so that should be OK.</p> <p>So should I include one CSS and one Javascript file and have those include the rest? Should I concatenate all my files into one? Should I put Javascript my tags at the very end of my document?</p> <p><strong>Edit:</strong> FWIW yes this is PHP.</p>,490686,6,2,,1/29/2009 5:56:38,41,1/14/2012 16:17:27,1/14/2012 16:17:27,cletus,27637,cletus,18393,,1,52,php|javascript|jquery|html|css,18172
126430,Is it possible to change the natural order of columns in Postgres?,<p>Is it possible to change the natural order of columns in Postgres 8.1?</p> <p>I know that you shouldn't rely on column order - it's not <em>essential</em> to what I am doing - I only need it to make some auto-generated stuff come out in a way that is more pleasing so that the field order matches all the way from pgadmin through the back end and out to the front end.</p>,656841,6,0,,9/24/2008 10:39:12,4,3/20/2013 13:10:35,,,,rjmunro,3408,,1,15,postgresql,18296
310479,Good database library/ORM for cocoa development,<p>I am developing a cocoa application that will be making heavy use of both web services and a standard dbms (most likely MySQL) and I am wondering if anyone has a good option for a database library or ORM solution they have used. CoreData is not an option due to the need to support a standard DBMS and to be able to modify the data outside of the normal application operation.</p> <p>I have found a number of possible options from new open source libraries: <a href= http://github.com/aptiva/activerecord/tree/master >http://github.com/aptiva/activerecord/tree/master</a></p> <p>To writing my own wrapper for the C MySQL api.</p> <p>Any advice is welcome</p> <p>Thanks!</p> <p>Paul</p>,468461,6,1,,11/21/2008 22:53:24,4,1/22/2009 8:54:41,,,,paulsnotes,39819,,1,5,objective-c|database|cocoa,6180
596315,Uploading files to Sharepoint (WSS 3.0) document library using HTTP PUT,<p>Hi I have the following piece of code to upload a file to Sharepoint. It uses HTTP PUT:</p> <pre><code>public static string UploadFile(string destUrl string sourcePath) { try { Uri destUri = new Uri(destUrl); FileStream inStream = File.OpenRead(sourcePath); WebRequest req = WebRequest.Create(destUri); req.Method = PUT ; req.Headers.Add( Overwrite  F ); req.Timeout = System.Threading.Timeout.Infinite; req.Credentials = CredentialCache.DefaultCredentials; Stream outStream = req.GetRequestStream(); string status = CopyStream(inStream outStream); if (status == success ) { outStream.Close(); WebResponse ores = req.GetResponse(); return success ; } else { return status; } } catch (WebException we) { return we.Message; } catch (System.Exception ee) { return ee.Message; } } </code></pre> <p>When I run this code I get the exception: </p> <blockquote> <p> The remote server returned an error: (409) Conflict. </p> </blockquote> <p>Does anyone have any ideas as to where I am going wrong?</p> <p>Thanks</p> <p>Alex</p>,2663918,6,4,,2/27/2009 19:46:50,8,12/1/2011 2:41:52,,,,tarbot2009,70772,,1,9,c#|sharepoint|http|upload,21545
368913,What's a good way to serialize Delphi object tree to XML--using RTTI and not custom code?,<p>What's a good way to serialize a Delphi object tree to XML--using RTTI and not custom code?</p> <p>I would have loved to find that this feature is already built into Delphi but it doesn't seem to be.</p> <p>I've found a few components (posted below) that seem like they might perform this function. Have you used any of them or some other offering? Have you built your own? Am I missing something obvious in Delphi?</p>,368972,7,0,,12/15/2008 16:29:22,11,10/1/2015 11:49:58,10/1/2015 11:49:58,Mattias Andersson,650492,Mattias Andersson,32841,,1,11,xml|delphi|serialization|xml-serialization|rtti,8916
